DAY 1;;;;;
Tuesday;11/19/2019;10:00 a.m. - 12:00 p.m.;Dreamforce Opening Keynote: Trailblazers, Together;https://www.salesforce.com/video/7488085/;https://www.youtube.com/watch?v=msNCdAjCaYs
Tuesday;11/19/2019;12:00 p.m - 12:45p.m;Is 5G the Future?;https://www.salesforce.com/video/7488076;https://www.youtube.com/watch?v=O01EYofV1Tg
Tuesday;11/19/2019;1:30 p.m. - 2:00 p.m.;Fireside Chat with Tim Cook and Marc Benioff;https://www.salesforce.com/video/7790887/;https://www.youtube.com/watch?v=UT_BPGgp4Sw
Tuesday;11/19/2019;1:30 p.m. - 2:15 p.m.;Future of Work: How AI Will Affect Our Workforce in the 5IR;https://www.salesforce.com/video/7502344;https://www.youtube.com/watch?v=8BvJ2raPhxU
Tuesday;11/19/2019;1:30 p.m. - 2:30 p.m.;Quip Keynote: Improve Productivity for Sales and Service Teams;https://www.salesforce.com/video/7502350;https://www.youtube.com/watch?v=E5XcHUTebTQ
Tuesday;11/19/2019;2:45 p.m - 3:30 p.m.;Fireside Chat with Marco Bizzarri and Marc Benioff;https://www.salesforce.com/video/7499998/;https://www.youtube.com/watch?v=UT_BPGgp4Sw
Tuesday;11/19/2019;2:45 p.m. - 3:45 p.m.;Partner Keynote: Building a Different Kind of Partnership;https://www.salesforce.com/video/7490468;https://www.youtube.com/watch?v=CiqLOKUqyA0
Tuesday;11/19/2019;3:00 p.m. - 3:45 p.m.;Building Ethical AI That Scales with Your Business;https://www.salesforce.com/video/7687170/;https://www.youtube.com/watch?v=AF28dXlpaWQ
Tuesday;11/19/2019;3:00 p.m. - 4:00 p.m.;Salesforce For B2B Marketing: How Trailblazers Transform Customer Engagement;https://www.salesforce.com/video/7502337;https://www.youtube.com/watch?v=WVYs9LbHWQA
Tuesday;11/19/2019;4:15 p.m. - 5:00 p.m.;Film as a Platform for Change and a Force for Good;https://www.salesforce.com/video/7642054/;https://www.youtube.com/watch?v=sjTsfVGdiMw
Tuesday;11/19/2019;4:30 p.m. - 5:30 p.m.;Creating the Future of AI: How Salesforce Research Advances AI for CRM;https://www.salesforce.com/video/7541409/;https://www.youtube.com/watch?v=3fAuOV6ahqc
Tuesday;11/19/2019;4:30 p.m. - 5:30 p.m.;AppExchange Partner Keynote: Succeed in the Fastest Growing Cloud Marketplace;https://www.salesforce.com/video/7490471/;https://www.youtube.com/watch?v=z7yCu7-jwbs
Tuesday;11/19/2019;4:30 p.m. - 5:30 p.m.;How Uber Overcame the Challenges of Quickly Scaling a Global Workforce;http://www.salesforce.com/video/7750588/;https://www.youtube.com/watch?v=uj6CqK2Vz2s
Tuesday;11/19/2019;9:00 a.m. - 9:30 a.m;Welcome to Dreamforce! Day One;https://www.salesforce.com/video/7711995/;https://www.youtube.com/watch?v=ojIx4WW3haU
Tuesday;11/19/2019;11:30 a.m. - 12:00 p.m;Dreamforce 19 Opening Keynote Wrap Show;https://www.salesforce.com/video/7711996/;https://www.youtube.com/watch?v=F7EBhMAyNhs
Tuesday;11/19/2019;12:30 p.m. - 1:00 p.m;Reimagining the Automotive Retail Experience;https://www.salesforce.com/video/7733342/;https://www.youtube.com/watch?v=4zsBYGyZIEI
Tuesday;11/19/2019;1:00 p.m. - 2:00 p.m;Deepening Engagement with Tailor-Made Solutions;https://www.salesforce.com/video/7722813/;https://www.youtube.com/watch?v=HXNtl-j_rS0
Tuesday;11/19/2019;2:00 p.m. - 2:30 p.m;Accenture CIO’s Journey with Analytics;https://www.salesforce.com/video/7674313/;https://www.youtube.com/watch?v=nLtEd8Z8cQI
Tuesday;11/19/2019;2:30 p.m. - 3:00 p.m;Putting Humans First with Technology;https://www.salesforce.com/video/7674296;https://www.youtube.com/watch?v=j0eLEGuTVNQ
Tuesday;11/19/2019;3:00 p.m. - 3:30 p.m;How Salesforce + Vlocity are helping CenturyLink transform;https://www.salesforce.com/video/7674300/;https://www.youtube.com/watch?v=h9Ia4D_BYp8
Tuesday;11/19/2019;3:30 p.m. - 4:00 p.m;Leadership in an Intelligent, Experience Based Economy;https://www.salesforce.com/video/7674301/;https://www.youtube.com/watch?v=QXfTrxwIswM
Tuesday;11/19/2019;4:30p.m. - 4:45 p.m;AirAsia travels to new heights of customer happiness with Salesforce;https://www.salesforce.com/video/7722815/;https://www.youtube.com/watch?v=LJbrwye5t5o
Tuesday;11/19/2019;4:45 p.m. - 5:00 p.m;The evolution of K-Bot, Kayo’s AI service bot powered by Salesforce Einstein;https://www.salesforce.com/video/7722814/;https://www.youtube.com/watch?v=xZOLTkqY854
Tuesday;11/19/2019;5:00 p.m. - 5:30 p.m;How SurveyMonkey is Accelerating its Salesforce Strategy;https://www.salesforce.com/video/7733341/;https://www.youtube.com/watch?v=WNQl7MgNPfk
DAY 2;;;;;
Wednesday;11/20/2019;9:00 a.m. - 10:00 a.m.;Salesforce Einstein Keynote: Your AI Journey Begins Here;https://www.salesforce.com/video/7488079;https://www.youtube.com/watch?v=rPm--W0qeRs
Wednesday;11/20/2019;9:00 a.m. - 10:00 a.m.;Developer Keynote: Continuous Innovation with the Customer 360 Platform;https://www.salesforce.com/video/7490459;https://www.youtube.com/watch?v=id7Oa65Rs1k
Wednesday;11/20/2019;9:15 a.m. - 10:00 a.m.;Future of Work: Leading in the New Era;https://www.salesforce.com/video/7502345;https://www.youtube.com/watch?v=uo02BEqSujU
Wednesday;11/20/2019;9:30 a.m. - 10:00 a.m;Einstein Analytics And Discovery Roadmap;https://www.salesforce.com/video/7694975/;https://www.youtube.com/watch?v=hqxqcvGT1nM
Wednesday;11/20/2019;10:00 a.m. - 10:45 a.m.;CEO Fireside Chat with Marc Benioff and Arianna Huffington;https://www.salesforce.com/video/7562645/;https://www.youtube.com/watch?v=yTOr_rBKMiw
Wednesday;11/20/2019;11:00 a.m. - 12:00 p.m.;Sales Keynote: Grow Your Business Today & Build Relationships for Tomorrow;https://www.salesforce.com/video/7488081;https://www.youtube.com/watch?v=emxF6yuC9Q8
Wednesday;11/20/2019;11:00 a.m. - 12:00 p.m.;Trailhead Keynote: Skill Up For The Future;https://www.salesforce.com/video/7490461;https://www.youtube.com/watch?v=qixAic9LoEk
Wednesday;11/20/2019;11:00 a.m. - 12:00 p.m.;Manufacturing, Auto, & Energy Keynote: Transform Your Digital Operating Model;https://www.salesforce.com/video/7502338;https://www.youtube.com/watch?v=n0ygO21NLTc
Wednesday;11/20/2019;11:30 a.m. - 12:15 p.m.;Global Officials Panel: Improving the State of the World Starts with Trust;https://www.salesforce.com/video/7499997/;https://www.youtube.com/watch?v=w_wJyEe_EpE
Wednesday;11/20/2019;11:15 a.m. - 12:00 p.m.;Future of Financial Services: Driving Change in the Digital Economy;https://www.salesforce.com/video/7502346;https://www.youtube.com/watch?v=J3sLnL0aLrU
Wednesday;11/20/2019;1:00 p.m. - 2:00 p.m.;Platform Keynote: Digitally Transform with the Next-Gen Customer 360 Platform;https://www.salesforce.com/video/7488082;https://www.youtube.com/watch?v=_ejTH1HSlXk
Wednesday;11/20/2019;1:00 p.m. - 2:00 p.m.;Commerce Keynote: Drive Transformational Growth with an AI Platform;https://www.salesforce.com/video/7490460;https://www.youtube.com/watch?v=IiLYaqFPcqI
Wednesday;11/20/2019;1:15 p.m. - 2:00 p.m.;The $12T Opportunity Behind the SDGs;https://www.salesforce.com/video/7500000/;https://www.youtube.com/watch?v=yTaghFtnkNs
Wednesday;11/20/2019;1:15 p.m. - 2:00 p.m.;Future of Retail: Redefining the Customer Experience;https://www.salesforce.com/video/7502347;https://www.youtube.com/watch?v=UpfQujvVZXc
Wednesday;11/20/2019;1:30 p.m. - 2:30 p.m.;Field Service Keynote: Redefining the Future of Field Service;https://www.salesforce.com/video/7502342;https://www.youtube.com/watch?v=lSMjvmwhSpM
Wednesday;11/20/2019;2:45 p.m. - 3:30 p.m.;Fireside Chat with Ayesha and Steph Curry;https://www.salesforce.com/video/7729584/;https://www.youtube.com/watch?v=wNQ5F7DKDjs
Wednesday;11/20/2019;3:00 p.m. - 4:00 p.m.;Tableau Keynote: Helping People See and Understand Data;https://www.salesforce.com/video/7616741/;https://www.youtube.com/watch?v=YZubT8PscJE
Wednesday;11/20/2019;3:00 p.m. - 4:00 p.m.;Financial Services Keynote: Accelerate Transformation and Inspire Customer Trust;https://www.salesforce.com/video/7490458;https://www.youtube.com/watch?v=eZxm3VB5bVM
Wednesday;11/20/2019;3:00 p.m. - 4:00 p.m.;Lightning Keynote: Build Dynamic Experiences;https://www.salesforce.com/video/7502341;https://www.youtube.com/watch?v=9spxeRJ2BRU
Wednesday;11/20/2019;3:15 p.m. - 4:00 p.m.;Future of Healthcare and Life Sciences: Driving Toward Better Outcomes;https://www.salesforce.com/video/7502348;https://www.youtube.com/watch?v=xxQVU53fdbs
Wednesday;11/20/2019;4:30 p.m. - 5:30 p.m.;True to the Core with Parker Harris and Bret Taylor;https://www.salesforce.com/video/7502343;https://www.youtube.com/watch?v=Wpveu2Ef8-Q
Wednesday;11/20/2019;5:00 p.m. - 5:45 p.m.;The Path to Gender Equality;https://www.salesforce.com/video/7502352;https://www.youtube.com/watch?v=m_O0b5PtCfQ
Wednesday;11/20/2019;5:00 p.m. - 6:00 p.m.;Integration Keynote: Unleash the Power of Salesforce Customer 360 with APIs;https://www.salesforce.com/video/7488080;https://www.youtube.com/watch?v=Nu_H7lOstCg
Wednesday;11/20/2019;5:00 p.m. - 6:00 p.m.;Healthcare & Life Sciences Keynote: Transform Health & Wellness Experiences;https://www.salesforce.com/video/7490469;https://www.youtube.com/watch?v=IX9K0DUOYlI
Wednesday;11/20/2019;8:30 a.m. - 9:00 a.m;Welcome to Dreamforce 19 - Day Two;https://www.salesforce.com/video/7711998/;https://www.youtube.com/watch?v=JJIQidmCOuI
Wednesday;11/20/2019;9:00 a.m. - 9:30 a.m;How Pacers Sports & Entertainment Creates the Ultimate Fan Experience;https://www.salesforce.com/video/7674297/;https://www.youtube.com/watch?v=62_u_w6-iDw
Wednesday;11/20/2019;9:30 a.m. - 10:00 a.m;Appirio providing 360 views for Universities around the world;https://www.salesforce.com/video/7674303/;https://www.youtube.com/watch?v=DKWkH0Ghvhg
Wednesday;11/20/2019;10:00 a.m. - 10:30 a.m;Customer 360 for SMB;https://www.salesforce.com/video/7674298/;https://www.youtube.com/watch?v=16vb0o5-2lg
Wednesday;11/20/2019;10:30 a.m. - 11:00 a.m;How Pilot and Flying J Travel Centers transforming customer engagement;https://www.salesforce.com/video/7722816/;https://www.youtube.com/watch?v=0HpHJ5bupHU
Wednesday;11/20/2019;11:00 a.m. - 11:30 a.m;Changing the World, One Cup of Coffee At a Time;https://www.salesforce.com/video/7674302/;https://www.youtube.com/watch?v=1YOpZxf_zAE
Wednesday;11/20/2019;1:00 p.m. - 1:20 p.m;How United Way uses AI to Solve the Next Generation of Complex Problems;https://www.salesforce.com/video/7674304/;https://www.youtube.com/watch?v=p_A3GeGITmM
Wednesday;11/20/2019;1:20 p.m. - 2:00 p.m;Learn how Airbnb engages customers across the globe with Salesforce;https://www.salesforce.com/video/7707644/;https://www.youtube.com/watch?v=wTwwKVa9eS4
Wednesday;11/20/2019;2:00 p.m. - 2:30 p.m;Pacific Life and the Power of Customer 360;https://www.salesforce.com/video/7784759/;https://www.youtube.com/watch?v=wnVaotDiLCc
Wednesday;11/20/2019;2:00 p.m. - 2:30 p.m;The Keys to Successful Collaboration: Purpose and Context;https://www.salesforce.com/video/7782427/;https://www.youtube.com/watch?v=iEInN1dCvaw
Wednesday;11/20/2019;3:00 p.m. - 3:30 p.m;How Appirio helps customers close the Experience Gap;https://www.salesforce.com/video/7674306/;https://www.youtube.com/watch?v=iIri2IU44uY
Wednesday;11/20/2019;3:30 p.m. - 4:00 p.m;How Lamborghini makes every customer experience extraordinary with Salesforce;https://www.salesforce.com/video/7674305/;https://www.youtube.com/watch?v=puGe9OE3y6I
Wednesday;11/20/2019;4:00 p.m. - 4:30 p.m.;Thankyou for buying: the story behind Australia's FMCG social enterprise;https://www.salesforce.com/video/7707643/;https://www.youtube.com/watch?v=cilf-hTbkrU
Wednesday;11/20/2019;4:30 p.m. - 5:00 p.m.;How Edelman Financial Engines Delivers Better Financial Futures with Salesforce;https://www.salesforce.com/video/7674307/;https://www.youtube.com/watch?v=MYEINZDv0bs
Wednesday;11/20/2019;5:00 p.m. - 5:30 p.m.;ABB Unites 30k Users on One Integrated Platform;http://www.salesforce.com/video/7710246/;https://www.youtube.com/watch?v=30_420VdCYI
DAY 3;;;;;
Thursday;11/21/2019;9:00 a.m. - 10:00 a.m.;Consumer Goods Keynote: Unlock Agility And Relevance In Your Value Chain;https://www.salesforce.com/video/7502339;https://www.youtube.com/watch?v=AE5VG7o-pXo
Thursday;11/21/2019;9:00 a.m. - 9:45 a.m;Representation Matters;https://www.salesforce.com/video/7490463/;https://www.youtube.com/watch?v=hEwyZRUcXNs
Thursday;11/21/2019;9:00 a.m. - 9:45 a.m.;Food Systems and Climate Justice;https://www.salesforce.com/video/7502353;https://www.youtube.com/watch?v=EIwdgcK2nu0
Thursday;11/21/2019;12:00 p.m. - 12:45 p.m.;CEOs Advocating for Equality;https://www.salesforce.com/video/7490465/;https://www.youtube.com/watch?v=PaZ2qn0peWI
Thursday;11/21/2019;12:30 p.m. - 1:30 p.m.;Small Business Keynote: The Path to Your Best Business;https://www.salesforce.com/video/7490464;https://www.youtube.com/watch?v=E8-nritJIXk
Thursday;11/21/2019;1:00 p.m. - 1:45 p.m.;From Protests to Policy: Youth Demand Climate Action;https://www.salesforce.com/video/7502351;https://www.youtube.com/watch?v=Gi_wCF3kJNQ
Thursday;11/21/2019;1:00 p.m. - 2:00 p.m.;Service Keynote: The New Age of Human-Centric Service;https://www.salesforce.com/video/7488084;https://www.youtube.com/watch?v=2CDpq-MuD5g
Thursday;11/21/2019;1:30 p.m. - 2:30 p.m.;CPQ & Billing Keynote: Power Your Quote-to-Cash with the Customer 360 Platform;https://www.salesforce.com/video/7502340;https://www.youtube.com/watch?v=YsS0jT5cHQw
Thursday;11/21/2019;1:30 p.m. - 2:15 p.m;Trust Is the Currency of Business: Fireside Chat with CEOs of Uber & Salesforce;https://www.salesforce.com/video/7711993/;https://www.youtube.com/watch?v=uj6CqK2Vz2s
Thursday;11/21/2019;1:45 p.m. - 2:30 p.m.;From Athlete to Advocate with World Cup and Olympic Champion Megan Rapinoe;https://www.salesforce.com/video/7499999/;https://www.youtube.com/watch?v=BQF4MWbHCKg
Thursday;11/21/2019;2:30 p.m. - 3:30 p.m.;Marketing Keynote: The New Decade of Data, Trust and Engagement;https://www.salesforce.com/video/7490462;https://www.youtube.com/watch?v=TZnhn_t7NNM
Thursday;11/21/2019;2:45 p.m. - 3:30 p.m.;Fireside Chat with Lars Ulrich and YoYo Ma;https://www.salesforce.com/video/7729550/;https://www.youtube.com/watch?v=BeTRlXHlNnI
Thursday;11/21/2019;3:00 p.m. - 4:00 p.m.;Customer Success Keynote: Your Path to Succeeding with Salesforce;https://www.salesforce.com/video/7488083;https://www.youtube.com/watch?v=F4WVnle-pEo
Thursday;11/21/2019;3:00 p.m. - 4:00 p.m;Next Generation Workforce Panel;http://www.salesforce.com/video/7711994/;https://www.youtube.com/watch?v=dZdiVhM054M
Thursday;11/21/2019;3:00 p.m. - 4:00 p.m.;Einstein Analytics Keynote: The Intelligence Imperative;https://www.salesforce.com/video/7488078;https://www.youtube.com/watch?v=XOHD-MDkhFU
Thursday;11/21/2019;4:15 p.m. - 5:00 p.m.;The Planet's Two Lungs: Oceans and Forests;https://www.salesforce.com/video/7502349;https://www.youtube.com/watch?v=ZsrfRIUmuk8
Thursday;11/21/2019;4:30 p.m. - 5:30 p.m.;Digital Experience Keynote: Maximize Your Return on Experience;https://www.salesforce.com/video/7490470;https://www.youtube.com/watch?v=pjAEszsEjaQ
Thursday;11/21/2019;4:45 p.m. - 5:30 p.m.;Future of Digital Transformation: Moving from Discovery to Delivery;https://www.salesforce.com/video/7490467/;https://www.youtube.com/watch?v=_8Dp8tmMqG4
Thursday;11/21/2019;5:00 p.m. - 6:00 p.m.;Salesforce for Admins Keynote: Transform Your Company, Career, Community;https://www.salesforce.com/video/7488077;https://www.youtube.com/watch?v=PsWaWMpvMw0
Thursday;11/21/2019;8:30 a.m. - 9:00 a.m;Welcome to Dreamforce - Day Three;https://www.salesforce.com/video/7712002/;https://www.youtube.com/watch?v=8ouCPelHB-8
Thursday;11/21/2019;9:30 a.m. - 10:00 a.m;The State of Salesforce 2020:How the Best Companies Use Salesforce with Autodesk;https://www.salesforce.com/video/7674309/;https://www.youtube.com/watch?v=QDIXdQsxGdI
Thursday;11/21/2019;10:00 a.m. - 10:30 a.m;Building Trust With New Technology;https://www.salesforce.com/video/7674308/;https://www.youtube.com/watch?v=y8aK5MBLB8A
Thursday;11/21/2019;10:30 a.m. - 10:50 a.m;#CustomerObsessed: How ZeroCater Is Building a Customer-Centric Company;https://www.salesforce.com/video/7707642/;https://www.youtube.com/watch?v=49s9grk0dv8
Thursday;11/21/2019;10:50 a.m. - 11:30 a.m;Providing Deeply Personal Customer Experiences;https://www.salesforce.com/video/7674310/;https://www.youtube.com/watch?v=Zk0Ctti6BiI
Thursday;11/21/2019;1:00 p.m. - 1:20 p.m;Becoming the Factory of Tomorrow with Europe's Leading Industrial Services Provider, Leadec;https://www.salesforce.com/video/7674311/;https://www.youtube.com/watch?v=qotC5-h29wE
Thursday;11/21/2019;2:30 p.m. - 3:00 p.m;How Align Technology runs its customer and Invisalign® consumer business;https://www.salesforce.com/video/7687323/;https://www.youtube.com/watch?v=yaZqMAabCY8
Thursday;11/21/2019;3:00 p.m. - 3:30 p.m;How the Diversity of Thought is the Key to Innovation;https://www.salesforce.com/video/7807464/;https://www.youtube.com/watch?v=cbgTQZKEF6o
Thursday;11/21/2019;3:30 p.m. - 4:00 p.m;Learning in the New with myTrailhead;https://www.salesforce.com/video/7674312/;https://www.youtube.com/watch?v=lxk62RDAVvE
DAY 4;;;;;
Friday;11/22/2019;9:00 a.m. - 10:00 a.m.;The Nature of Reality, Exploring Metahuman with Deepak Chopra, MD;http://www.salesforce.com/video/7761771/;https://www.youtube.com/watch?v=E7gSfSV-bVg
Friday;11/22/2019;10:00 a.m. - 10:45 a.m.;Brain Health and Resilience: Fireside Chat with Emilia Clarke and Bennet Omalu;https://www.salesforce.com/video/7761772/;https://www.youtube.com/watch?v=-97Hflj2uqk
Friday;11/22/2019;11:00 a.m - 12:00 p.m;Brain Health and Resilience: Plum Village Monastics;https://www.salesforce.com/video/7490466/;https://www.youtube.com/watch?v=RRx5GtQMRNc
Friday;11/22/2019;8:30 a.m. - 9:00 a.m;Welcome to Dreamforce - Day Four;https://www.salesforce.com/video/7722812/;https://www.youtube.com/watch?v=mF9IBrdaaYQ
Friday;11/22/2019;9:00 a.m. - 9:30 a.m.;Employee Engagement, Philanthropy, and the new United Way;https://www.salesforce.com/video/7707645/;https://www.youtube.com/watch?v=xO2rVfNzMB4
Friday;11/22/2019;10:00 a.m. - 10:30 p.m;The Future of Transportation and Logistics;http://www.salesforce.com/video/7734562/;https://www.youtube.com/watch?v=XJzaWUL5s5g
Friday;11/22/2019;11:30 a.m. - 12:00 p.m;That's a wrap on Dreamforce 19!;https://www.salesforce.com/video/7712004/;https://www.youtube.com/watch?v=u2lX9aMU0h4
